{
  "doc_id": "DOC-0001",
  "doc_type": "test_method",
  "title": "SPK EMI Test Method Sample",
  "path": "data/sample/rag/corpora/test_methods/TM-0001.md",
  "source_level": "internal_summary",
  "version": "sample-v0",
  "effective_date": "2026-07-08",
  "keywords": [
    "SPK",
    "EMI",
    "test method",
    "cable",
    "load"
  ],
  "sensitivity": "allowed",
  "created_at": "2026-07-07T16:06:24.202380Z",
  "review_status": "approved_for_rag"
}
